{
  "reviewId": "REV-001",
  "reviewer": {
    "agent": "quality-auditor",
    "timestamp": "2026-09-17T14:30:00Z"
  },
  "reviewedArtifacts": [
    "source-inventory.json",
    "physical-data-model.json",
    "proc-semantic-catalog.json",
    "dependency-graph.json",
    "sas-traps-ledger.json",
    "business-rules.json",
    "semantic-model.json",
    "uncertainty-assumptions-register.json"
  ],
  "findings": [
    {
      "findingId": "FINDING-001",
      "severity": "INFORMATIONAL",
      "component": "physical-data-model.json",
      "issue": "External RAW library datasets (RAW.customers, RAW.products, RAW.sales) lack DDL in SAS source.",
      "evidence": "LIBNAME RAW \"/data/raw/sales\"; set statements without preceding create table.",
      "recommendation": "Recorded schemaStatus as PARTIAL_SCHEMA_UNKNOWN with inferred downstream usage.",
      "status": "RESOLVED"
    },
    {
      "findingId": "FINDING-002",
      "severity": "INFORMATIONAL",
      "component": "sas-traps-ledger.json",
      "issue": "Identified FIRST.customer_id at line 50 evaluated without preceding BY customer_id statement.",
      "evidence": "data WORKLIB.customer_base; ... if first.customer_id then customer_name=strip(customer_name);",
      "recommendation": "Flagged in traps ledger TRAP-010 for explicit control-break validation in Phase 2.",
      "status": "RESOLVED"
    }
  ],
  "traceabilityAssessment": {
    "status": "COMPLETE",
    "coveragePercentage": 100
  },
  "referentialIntegrityAssessment": {
    "status": "PASSED"
  },
  "uncertaintyAssessment": {
    "openCriticalCount": 0,
    "status": "ACCEPTABLE"
  },
  "overallDisposition": "APPROVED",
  "blockers": []
}